10:51:55.173197 arp who-has 10.0.1.254 tell 10.0.1.12
10:51:56.173194 arp who-has 10.0.1.254 tell 10.0.1.12
10:51:57.173186 arp who-has 10.0.1.254 tell 10.0.1.12
10:52:05.300743 IP 10.0.1.12 > 10.0.1.255: ICMP echo request, id 36384, seq 1, length 64
10:52:05.300886 IP 10.0.1.11 > 10.0.1.12: ICMP echo reply, id 36384, seq 1, length 64
10:52:05.300928 IP 10.0.1.14 > 10.0.1.12: ICMP echo reply, id 36384, seq 1, length 64
10:52:05.300934 IP 10.0.1.13 > 10.0.1.12: ICMP echo reply, id 36384, seq 1, length 64
10:52:06.300724 IP 10.0.1.12 > 10.0.1.255: ICMP echo request, id 36384, seq 2, length 64
10:52:06.300825 IP 10.0.1.11 > 10.0.1.12: ICMP echo reply, id 36384, seq 2, length 64
10:52:06.300834 IP 10.0.1.14 > 10.0.1.12: ICMP echo reply, id 36384, seq 2, length 64
10:52:06.300846 IP 10.0.1.13 > 10.0.1.12: ICMP echo reply, id 36384, seq 2, length 64
10:52:10.297260 arp who-has 10.0.1.12 tell 10.0.1.11
10:52:10.297290 arp reply 10.0.1.12 is-at 00:18:8b:1a:be:17
10:52:10.300667 arp who-has 10.0.1.12 tell 10.0.1.14
10:52:10.300679 arp reply 10.0.1.12 is-at 00:18:8b:1a:be:17
10:52:10.314716 arp who-has 10.0.1.12 tell 10.0.1.13
10:52:10.314727 arp reply 10.0.1.12 is-at 00:18:8b:1a:be:17

