10:21:57.693199 arp who-has 10.0.1.254 tell 10.0.1.12
10:21:58.693188 arp who-has 10.0.1.254 tell 10.0.1.12
10:21:59.693186 arp who-has 10.0.1.254 tell 10.0.1.12
10:22:14.269202 arp who-has 10.0.1.254 tell 10.0.1.12
10:22:15.269187 arp who-has 10.0.1.254 tell 10.0.1.12
10:22:16.269186 arp who-has 10.0.1.254 tell 10.0.1.12
10:23:23.995626 IP 10.0.1.12 > 10.0.1.255: ICMP echo request, id 25119, seq 1, length 64
10:23:23.995757 IP 10.0.1.14 > 10.0.1.12: ICMP echo reply, id 25119, seq 1, length 64
10:23:23.995769 IP 10.0.1.11 > 10.0.1.12: ICMP echo reply, id 25119, seq 1, length 64
10:23:24.994626 IP 10.0.1.12 > 10.0.1.255: ICMP echo request, id 25119, seq 2, length 64
10:23:24.994726 IP 10.0.1.14 > 10.0.1.12: ICMP echo reply, id 25119, seq 2, length 64
10:23:24.994747 IP 10.0.1.11 > 10.0.1.12: ICMP echo reply, id 25119, seq 2, length 64
10:23:28.992520 arp who-has 10.0.1.12 tell 10.0.1.14
10:23:28.992548 arp reply 10.0.1.12 is-at 00:18:8b:1a:be:17
10:23:28.995642 arp who-has 10.0.1.12 tell 10.0.1.11
10:23:28.995650 arp reply 10.0.1.12 is-at 00:18:8b:1a:be:17

